{
  "fixtureId": "semantic.weighted-binary-confidence-penalty.v7",
  "tensorGeometry": {
    "seqLen": 2,
    "featureDim": 8
  },
  "modelContract": {
    "targetContract": {
      "slots": [
        {
          "identity": "OpaqueBinaryEvent",
          "observedConstraint": {
            "constraint": "ClosedInterval",
            "minimum": 0,
            "maximum": 1
          },
          "lossInputTransformation": "Identity",
          "publicPredictionTransformation": "Sigmoid"
        }
      ]
    },
    "objective": {
      "directComponents": [
        {
          "identity": "direct.opaque-binary-event",
          "operator": "PositiveClassWeightedBinaryCrossEntropyWithLogits",
          "weight": 1,
          "positiveClassWeight": 28,
          "targetIdentity": "OpaqueBinaryEvent"
        }
      ],
      "auxiliaryComponents": [
        {
          "identity": "auxiliary.confidence",
          "operator": "BernoulliConfidencePenalty",
          "weight": 0.1,
          "roles": {
            "probability": "OpaqueBinaryEvent"
          }
        }
      ]
    },
    "modelTuning": {
      "hiddenWidth": 16,
      "encoderLayerCount": 1,
      "dropoutProbability": 0,
      "attentionHeadCount": 4,
      "missingValuePolicy": "strict",
      "encoderNormalizationOrder": "postNorm"
    }
  },
  "expected": {
    "validation": "accepted",
    "targetContractSha256": "12149168e0bdaa48380f196f5f4db3ac512401a732b9e16ed152e9eb137541c7",
    "objectiveSha256": "d774b0845cd05725de7d5e8330a043a8d034d34d58fb15d843c2d89877fbd2c2"
  }
}
