{
  "fixtureId": "semantic.target-reorder-a-b.v3",
  "tensorGeometry": {"seqLen": 2, "featureDim": 4},
  "modelContract": {
    "targetContract": {
      "slots": [
        {
          "identity": "A",
          "lossInputTransformation": "Identity",
          "publicPredictionTransformation": "Identity"
        },
        {
          "identity": "B",
          "lossInputTransformation": "Identity",
          "publicPredictionTransformation": "Identity"
        }
      ]
    },
    "objective": {
      "directComponents": [
        {
          "identity": "direct.a",
          "operator": "SmoothL1",
          "weight": 1,
          "targetIdentity": "A"
        },
        {
          "identity": "direct.b",
          "operator": "SmoothL1",
          "weight": 1,
          "targetIdentity": "B"
        }
      ]
    },
    "modelTuning": {
      "hiddenWidth": 8,
      "encoderLayerCount": 1,
      "dropoutProbability": 0,
      "attentionHeadCount": 2,
      "missingValuePolicy": "strict"
    }
  },
  "expected": {
    "validation": "accepted",
    "targetContractSha256": "c4796191bbd27b29b86bf35a0371014ac9fbdbc45c5653c22568039519673057",
    "objectiveSha256": "c42761934cec7af99ef553c92ea09dcef13f4442beeede4b6fb99ffda5ebad4e"
  }
}
