{
  "fixtureId": "semantic.target-reorder-b-a.v3",
  "tensorGeometry": {"seqLen": 2, "featureDim": 4},
  "modelContract": {
    "targetContract": {
      "slots": [
        {
          "identity": "B",
          "lossInputTransformation": "Identity",
          "publicPredictionTransformation": "Identity"
        },
        {
          "identity": "A",
          "lossInputTransformation": "Identity",
          "publicPredictionTransformation": "Identity"
        }
      ]
    },
    "objective": {
      "directComponents": [
        {
          "identity": "direct.b",
          "operator": "SmoothL1",
          "weight": 1,
          "targetIdentity": "B"
        },
        {
          "identity": "direct.a",
          "operator": "SmoothL1",
          "weight": 1,
          "targetIdentity": "A"
        }
      ]
    },
    "modelTuning": {
      "hiddenWidth": 8,
      "encoderLayerCount": 1,
      "dropoutProbability": 0,
      "attentionHeadCount": 2,
      "missingValuePolicy": "strict"
    }
  },
  "expected": {
    "validation": "accepted",
    "targetContractSha256": "ef55b4b3c0c9da79cff9b18078219926d0c1d555fe23998529a3268c9ea0a76e",
    "objectiveSha256": "f6848d3f7bc58870181edd7669fa58c3dfbe75922c5e761fb7f67d4e5473d3f5"
  }
}
