{
  "fixtureId": "semantic.single-regression.v7",
  "tensorGeometry": {
    "seqLen": 10,
    "featureDim": 64848
  },
  "modelContract": {
    "targetContract": {
      "slots": [
        {
          "identity": "MeanReturn",
          "observedConstraint": {
            "constraint": "ClosedInterval",
            "minimum": -1,
            "maximum": 1
          },
          "lossInputTransformation": "Tanh",
          "publicPredictionTransformation": "Tanh"
        }
      ]
    },
    "objective": {
      "directComponents": [
        {
          "identity": "direct.mean-return",
          "operator": "SmoothL1",
          "weight": 1,
          "targetIdentity": "MeanReturn"
        }
      ]
    },
    "modelTuning": {
      "hiddenWidth": 256,
      "encoderLayerCount": 5,
      "dropoutProbability": 0.1,
      "attentionHeadCount": 8,
      "missingValuePolicy": "relaxed",
      "encoderNormalizationOrder": "postNorm"
    }
  },
  "numericalCases": [
    {
      "identity": "tanh-smooth-l1",
      "inputs": {
        "rawCoordinate": 0.5,
        "observed": 0.25
      },
      "outputs": {
        "lossEstimate": 0.46211715726000974,
        "publicPrediction": 0.46211715726000974,
        "componentLoss": 0.02249684420203385
      },
      "absoluteTolerance": 1e-06
    }
  ],
  "expected": {
    "validation": "accepted",
    "targetContractSha256": "3166b9a9586968ecbf8fbacabda0a24e718fe09610683b02755554e42604130b",
    "objectiveSha256": "87994c7f87457ed4feb97f0ddec3383111fd063780c37f42776fc887d8465dbc"
  }
}
