{
  "fixtureId": "semantic.new-opaque-target.v5",
  "tensorGeometry": {
    "seqLen": 2,
    "featureDim": 8
  },
  "modelContract": {
    "targetContract": {
      "slots": [
        {
          "identity": "Opaque.EventProbability",
          "observedConstraint": {
            "constraint": "ClosedInterval",
            "minimum": 0,
            "maximum": 1
          },
          "lossInputTransformation": "Identity",
          "publicPredictionTransformation": "Sigmoid"
        }
      ]
    },
    "objective": {
      "directComponents": [
        {
          "identity": "direct.opaque-event",
          "operator": "BinaryCrossEntropyWithLogits",
          "weight": 1,
          "targetIdentity": "Opaque.EventProbability"
        }
      ]
    },
    "modelTuning": {
      "hiddenWidth": 16,
      "encoderLayerCount": 1,
      "dropoutProbability": 0,
      "attentionHeadCount": 4,
      "missingValuePolicy": "strict",
      "encoderNormalizationOrder": "postNorm"
    }
  },
  "expected": {
    "validation": "accepted",
    "targetContractSha256": "51c0ad4d8e7b590fd589192b8ebfd1199c5181c4a8615af39605df262d09780b",
    "objectiveSha256": "ad266a90d65e012929fde65c40757c128076f144a2eb69ded3bd6378296b74d0"
  }
}
